<?xml version="1.0" encoding="UTF-8"?>
<!DOCTYPE paisos SYSTEM "Paisos.dtd">
<paisos>
    <pais>
        <nom>Andorra</nom>
        <continent>Europa</continent>
        <num_hab>7500</num_hab>
        <govern/>
    </pais>
    <pais>
        <nom>Brasil</nom>
        <continent>Am√®rica</continent>
        <num_hab>60 milions</num_hab>
        <govern/>
    </pais>
</paisos>